{
  "schema_version": "1.0.0",
  "derived_from": {
    "software_version": "1.0.0",
    "observed_at": "2026-09-05",
    "source": "참조 프로파일이다. 실물 벤더 문서에서 파생하지 않았다(설계 §7.4). 실물 기종이 오면 이 값이 진짜 파생 근거를 담아야 한다."
  },
  "vendor": "picasso-ref",
  "model": "quadruped-b",
  "revision": 1,

  "skills": [
    {
      "skill_type": "navigate_to",
      "major": 1,
      "minor": 0,
      "pause_support": "UNKNOWN",
      "cancel_support": "NO",
      "parameters": [
        { "key": "location", "value_type": "STRING", "optional": false, "max_length": 256 }
      ]
    },
    {
      "skill_type": "inspect",
      "major": 1,
      "minor": 0,
      "pause_support": "YES",
      "cancel_support": "YES",
      "parameters": [
        { "key": "target", "value_type": "STRING", "optional": false, "max_length": 64 }
      ]
    }
  ],

  "publish_interval": { "min_seconds": 1, "max_seconds": 30 },
  "protocol_limits": { "max_string_length": 64, "max_array_length": 8 },
  "exclusive_control_required": false,

  "durations": [
    { "skill_type": "navigate_to", "seconds": 20 },
    { "skill_type": "inspect", "seconds": 12 }
  ],

  "failure_modes": [
    {
      "error_type": "LOCALIZATION_LOST",
      "rate": 0.002,
      "can_continue_current_task": false,
      "can_accept_new_task": false,
      "resolution": "NEEDS_INTERVENTION",
      "error_hint": "로봇을 알려진 랜드마크 앞으로 옮기고 재측위를 실행하십시오.",
      "active_until": "UNTIL_CLEARED"
    }
  ],

  "replay_buffer_size": 128
}
